<?xml version="1.0" encoding="UTF-8"?>
<!DOCTYPE sales_record [
    <!ELEMENT sales_record (date, customer, items)>
    <!ATTLIST sales_record record_id ID #REQUIRED>
    <!ELEMENT date (#PCDATA)>
    <!ELEMENT customer (customer_name, email)>
    <!ELEMENT customer_name (#PCDATA)>
    <!ELEMENT email (#PCDATA)>
    <!ELEMENT items (item+)>
    <!ELEMENT item (item_name, quantity, price)>
    <!ELEMENT item_name (#PCDATA)>
    <!ELEMENT quantity (#PCDATA)>
    <!ELEMENT price (#PCDATA)>
    <!ATTLIST price currency CDATA "EUR">
]>
<sales_record record_id="SR001">
    <date>2026-02-10</date>
    <customer>
        <customer_name>Pepito PÃ©rez</customer_name>
        <email>pepito_p@email.com</email>
    </customer>
    <items>
        <item>
            <item_name>External Hard Drive</item_name>
            <quantity>1</quantity>
            <price currency="EUR">89.99</price>
        </item>
        <item>
            <item_name>USB Hub</item_name>
            <quantity>2</quantity>
            <price currency="EUR">15.50</price>
        </item>
    </items>
</sales_record>